{
  "schemaVersion": 1,
  "catalog": "canary",
  "code": {
    "namespace": "RunicArtifex.Examples.Translations.Generated",
    "className": "CanaryText"
  },
  "defaultLocale": "en",
  "locales": [{ "tag": "en" }, { "tag": "de", "fallback": "en" }],
  "layers": [{ "name": "base", "priority": 0 }]
}
